root@COMP3134:~# tcpdump
tcpdump: verbose output suppressed, use -v or -vv for full protocol decode
listening on eth0, link-type EN10MB (Ethernet), capture size 262144 bytes
06:17:26.786566 IP 78.95.139.124.gds-db > 178.128.233.185.ftp: Flags [S], seq 3340813624, win 0, options [mss 1400], length 0
06:17:26.787969 IP 178.128.233.185.ssh > cpef81d0f81b843-cmf81d0f81b840.cpe.net.fido.ca.54364: Flags [P.], seq 3797293369:3797293477, ack 4068363703, win 501, length 108
06:17:26.788084 IP 178.128.233.185.ssh > cpef81d0f81b843-cmf81d0f81b840.cpe.net.fido.ca.54364: Flags [P.], seq 108:144, ack 1, win 501, length 36
06:17:26.788171 IP 178.128.233.185.ssh > cpef81d0f81b843-cmf81d0f81b840.cpe.net.fido.ca.54364: Flags [P.], seq 144:252, ack 1, win 501, length 108
06:17:26.788242 IP 178.128.233.185.ssh > cpef81d0f81b843-cmf81d0f81b840.cpe.net.fido.ca.54364: Flags [P.], seq 252:288, ack 1, win 501, length 36
06:17:26.788916 IP 178.128.233.185.37184 > dns.google.domain: 6630+ PTR? 185.233.128.178.in-addr.arpa. (46)
06:17:26.802093 IP cpef81d0f81b843-cmf81d0f81b840.cpe.net.fido.ca.54364 > 178.128.233.185.ssh: Flags [.], ack 108, win 508, length 0
06:17:26.802094 IP cpef81d0f81b843-cmf81d0f81b840.cpe.net.fido.ca.54364 > 178.128.233.185.ssh: Flags [.], ack 252, win 508, length 0
06:17:26.842426 IP cpef81d0f81b843-cmf81d0f81b840.cpe.net.fido.ca.54364 > 178.128.233.185.ssh: Flags [.], ack 288, win 507, length 0
06:17:26.867444 IP 178.128.233.185.ssh > 119.45.181.168.41360: Flags [P.], seq 2232736437:2232736505, ack 821036508, win 507, options [nop,nop,TS val 1028738859 ecr 74024828], length 68
06:17:26.885604 IP dns.google.domain > 178.128.233.185.37184: 6630 NXDomain 0/1/0 (113)
06:17:26.886094 IP 178.128.233.185.48601 > dns.google.domain: 56186+ PTR? 124.139.95.78.in-addr.arpa. (44)
06:17:26.894172 IP dns.google.domain > 178.128.233.185.48601: 56186 NXDomain 0/1/0 (104)
06:17:26.894499 IP 178.128.233.185.ssh > cpef81d0f81b843-cmf81d0f81b840.cpe.net.fido.ca.54364: Flags [P.], seq 288:452, ack 1, win 501, length 164
06:17:26.894615 IP 178.128.233.185.ssh > cpef81d0f81b843-cmf81d0f81b840.cpe.net.fido.ca.54364: Flags [P.], seq 452:488, ack 1, win 501, length 36
06:17:26.894866 IP 178.128.233.185.56739 > dns.google.domain: 1276+ PTR? 34.118.108.97.in-addr.arpa. (44)
06:17:26.903538 IP dns.google.domain > 178.128.233.185.56739: 1276 1/0/0 PTR cpef81d0f81b843-cmf81d0f81b840.cpe.net.fido.ca. (104)
06:17:26.903754 IP 178.128.233.185.ssh > cpef81d0f81b843-cmf81d0f81b840.cpe.net.fido.ca.54364: Flags [P.], seq 488:692, ack 1, win 501, length 204
06:17:26.903927 IP 178.128.233.185.ssh > cpef81d0f81b843-cmf81d0f81b840.cpe.net.fido.ca.54364: Flags [P.], seq 692:728, ack 1, win 501, length 36
06:17:26.904064 IP 178.128.233.185.ssh > cpef81d0f81b843-cmf81d0f81b840.cpe.net.fido.ca.54364: Flags [P.], seq 728:908, ack 1, win 501, length 180
06:17:26.904146 IP 178.128.233.185.ssh > cpef81d0f81b843-cmf81d0f81b840.cpe.net.fido.ca.54364: Flags [P.], seq 908:944, ack 1, win 501, length 36
06:17:26.904257 IP 178.128.233.185.ssh > cpef81d0f81b843-cmf81d0f81b840.cpe.net.fido.ca.54364: Flags [P.], seq 944:1124, ack 1, win 501, length 180
06:17:26.904415 IP 178.128.233.185.ssh > cpef81d0f81b843-cmf81d0f81b840.cpe.net.fido.ca.54364: Flags [P.], seq 1124:1160, ack 1, win 501, length 36
06:17:26.904572 IP 178.128.233.185.ssh > cpef81d0f81b843-cmf81d0f81b840.cpe.net.fido.ca.54364: Flags [P.], seq 1160:1340, ack 1, win 501, length 180
06:17:26.904730 IP 178.128.233.185.ssh > cpef81d0f81b843-cmf81d0f81b840.cpe.net.fido.ca.54364: Flags [P.], seq 1340:1376, ack 1, win 501, length 36
06:17:26.904953 IP 178.128.233.185.33386 > dns.google.domain: 12057+ PTR? 8.8.8.8.in-addr.arpa. (38)
06:17:26.905897 IP dns.google.domain > 178.128.233.185.33386: 12057 1/0/0 PTR dns.google. (62)
06:17:26.906302 IP cpef81d0f81b843-cmf81d0f81b840.cpe.net.fido.ca.54364 > 178.128.233.185.ssh: Flags [.], ack 488, win 513, length 0
06:17:26.906338 IP 178.128.233.185.ssh > cpef81d0f81b843-cmf81d0f81b840.cpe.net.fido.ca.54364: Flags [P.], seq 1376:1768, ack 1, win 501, length 392
06:17:26.906432 IP 178.128.233.185.ssh > cpef81d0f81b843-cmf81d0f81b840.cpe.net.fido.ca.54364: Flags [P.], seq 1768:1940, ack 1, win 501, length 172
06:17:26.906527 IP 178.128.233.185.ssh > cpef81d0f81b843-cmf81d0f81b840.cpe.net.fido.ca.54364: Flags [P.], seq 1940:1976, ack 1, win 501, length 36
06:17:26.906652 IP 178.128.233.185.ssh > cpef81d0f81b843-cmf81d0f81b840.cpe.net.fido.ca.54364: Flags [P.], seq 1976:2148, ack 1, win 501, length 172
06:17:26.906910 IP 178.128.233.185.33397 > dns.google.domain: 22040+ PTR? 168.181.45.119.in-addr.arpa. (45)
06:17:26.914959 IP dns.google.domain > 178.128.233.185.33397: 22040 NXDomain 0/1/0 (104)
06:17:26.916506 IP cpef81d0f81b843-cmf81d0f81b840.cpe.net.fido.ca.54364 > 178.128.233.185.ssh: Flags [.], ack 728, win 512, length 0
06:17:26.916506 IP cpef81d0f81b843-cmf81d0f81b840.cpe.net.fido.ca.54364 > 178.128.233.185.ssh: Flags [.], ack 944, win 511, length 0
06:17:26.916506 IP cpef81d0f81b843-cmf81d0f81b840.cpe.net.fido.ca.54364 > 178.128.233.185.ssh: Flags [.], ack 1160, win 510, length 0
06:17:26.916506 IP cpef81d0f81b843-cmf81d0f81b840.cpe.net.fido.ca.54364 > 178.128.233.185.ssh: Flags [.], ack 1376, win 509, length 0
06:17:26.916507 IP cpef81d0f81b843-cmf81d0f81b840.cpe.net.fido.ca.54364 > 178.128.233.185.ssh: Flags [.], ack 1940, win 507, length 0
06:17:26.916507 IP cpef81d0f81b843-cmf81d0f81b840.cpe.net.fido.ca.54364 > 178.128.233.185.ssh: Flags [.], ack 2148, win 513, length 0
06:17:26.916556 IP 178.128.233.185.ssh > cpef81d0f81b843-cmf81d0f81b840.cpe.net.fido.ca.54364: Flags [P.], seq 2148:5068, ack 1, win 501, length 2920
06:17:26.916650 IP 178.128.233.185.ssh > cpef81d0f81b843-cmf81d0f81b840.cpe.net.fido.ca.54364: Flags [P.], seq 5068:5468, ack 1, win 501, length 400
06:17:26.916697 IP 178.128.233.185.ssh > cpef81d0f81b843-cmf81d0f81b840.cpe.net.fido.ca.54364: Flags [P.], seq 5468:5504, ack 1, win 501, length 36
06:17:26.916806 IP 178.128.233.185.ssh > cpef81d0f81b843-cmf81d0f81b840.cpe.net.fido.ca.54364: Flags [P.], seq 5504:5644, ack 1, win 501, length 140
06:17:26.916885 IP 178.128.233.185.ssh > cpef81d0f81b843-cmf81d0f81b840.cpe.net.fido.ca.54364: Flags [P.], seq 5644:5680, ack 1, win 501, length 36
06:17:26.916987 IP 178.128.233.185.ssh > cpef81d0f81b843-cmf81d0f81b840.cpe.net.fido.ca.54364: Flags [P.], seq 5680:5812, ack 1, win 501, length 132
06:17:26.917066 IP 178.128.233.185.ssh > cpef81d0f81b843-cmf81d0f81b840.cpe.net.fido.ca.54364: Flags [P.], seq 5812:5848, ack 1, win 501, length 36
06:17:26.917169 IP 178.128.233.185.ssh > cpef81d0f81b843-cmf81d0f81b840.cpe.net.fido.ca.54364: Flags [P.], seq 5848:6020, ack 1, win 501, length 172
06:17:26.917250 IP 178.128.233.185.ssh > cpef81d0f81b843-cmf81d0f81b840.cpe.net.fido.ca.54364: Flags [P.], seq 6020:6056, ack 1, win 501, length 36
06:17:26.917350 IP 178.128.233.185.ssh > cpef81d0f81b843-cmf81d0f81b840.cpe.net.fido.ca.54364: Flags [P.], seq 6056:6244, ack 1, win 501, length 188
06:17:26.917430 IP 178.128.233.185.ssh > cpef81d0f81b843-cmf81d0f81b840.cpe.net.fido.ca.54364: Flags [P.], seq 6244:6280, ack 1, win 501, length 36
06:17:26.917531 IP 178.128.233.185.ssh > cpef81d0f81b843-cmf81d0f81b840.cpe.net.fido.ca.54364: Flags [P.], seq 6280:6468, ack 1, win 501, length 188
06:17:26.917611 IP 178.128.233.185.ssh > cpef81d0f81b843-cmf81d0f81b840.cpe.net.fido.ca.54364: Flags [P.], seq 6468:6504, ack 1, win 501, length 36
06:17:26.917709 IP 178.128.233.185.ssh > cpef81d0f81b843-cmf81d0f81b840.cpe.net.fido.ca.54364: Flags [P.], seq 6504:6692, ack 1, win 501, length 188
06:17:26.917819 IP 178.128.233.185.ssh > cpef81d0f81b843-cmf81d0f81b840.cpe.net.fido.ca.54364: Flags [P.], seq 6692:6728, ack 1, win 501, length 36
06:17:26.917922 IP 178.128.233.185.ssh > cpef81d0f81b843-cmf81d0f81b840.cpe.net.fido.ca.54364: Flags [P.], seq 6728:6916, ack 1, win 501, length 188
06:17:26.918001 IP 178.128.233.185.ssh > cpef81d0f81b843-cmf81d0f81b840.cpe.net.fido.ca.54364: Flags [P.], seq 6916:6952, ack 1, win 501, length 36
06:17:26.918106 IP 178.128.233.185.ssh > cpef81d0f81b843-cmf81d0f81b840.cpe.net.fido.ca.54364: Flags [P.], seq 6952:7100, ack 1, win 501, length 148
06:17:26.918184 IP 178.128.233.185.ssh > cpef81d0f81b843-cmf81d0f81b840.cpe.net.fido.ca.54364: Flags [P.], seq 7100:7136, ack 1, win 501, length 36
06:17:26.918282 IP 178.128.233.185.ssh > cpef81d0f81b843-cmf81d0f81b840.cpe.net.fido.ca.54364: Flags [P.], seq 7136:7260, ack 1, win 501, length 124
06:17:26.918359 IP 178.128.233.185.ssh > cpef81d0f81b843-cmf81d0f81b840.cpe.net.fido.ca.54364: Flags [P.], seq 7260:7296, ack 1, win 501, length 36
06:17:26.918457 IP 178.128.233.185.ssh > cpef81d0f81b843-cmf81d0f81b840.cpe.net.fido.ca.54364: Flags [P.], seq 7296:7468, ack 1, win 501, length 172
06:17:26.918534 IP 178.128.233.185.ssh > cpef81d0f81b843-cmf81d0f81b840.cpe.net.fido.ca.54364: Flags [P.], seq 7468:7504, ack 1, win 501, length 36
06:17:26.930653 IP cpef81d0f81b843-cmf81d0f81b840.cpe.net.fido.ca.54364 > 178.128.233.185.ssh: Flags [.], ack 5068, win 513, length 0
06:17:26.930654 IP cpef81d0f81b843-cmf81d0f81b840.cpe.net.fido.ca.54364 > 178.128.233.185.ssh: Flags [.], ack 5504, win 511, length 0
06:17:26.930654 IP cpef81d0f81b843-cmf81d0f81b840.cpe.net.fido.ca.54364 > 178.128.233.185.ssh: Flags [.], ack 5680, win 510, length 0
06:17:26.930654 IP cpef81d0f81b843-cmf81d0f81b840.cpe.net.fido.ca.54364 > 178.128.233.185.ssh: Flags [.], ack 5848, win 510, length 0
06:17:26.930654 IP cpef81d0f81b843-cmf81d0f81b840.cpe.net.fido.ca.54364 > 178.128.233.185.ssh: Flags [.], ack 6056, win 509, length 0
06:17:26.930655 IP cpef81d0f81b843-cmf81d0f81b840.cpe.net.fido.ca.54364 > 178.128.233.185.ssh: Flags [.], ack 6280, win 508, length 0
06:17:26.930655 IP cpef81d0f81b843-cmf81d0f81b840.cpe.net.fido.ca.54364 > 178.128.233.185.ssh: Flags [.], ack 6504, win 507, length 0
06:17:26.930655 IP cpef81d0f81b843-cmf81d0f81b840.cpe.net.fido.ca.54364 > 178.128.233.185.ssh: Flags [.], ack 6728, win 513, length 0
06:17:26.930722 IP 178.128.233.185.ssh > cpef81d0f81b843-cmf81d0f81b840.cpe.net.fido.ca.54364: Flags [P.], seq 7504:10424, ack 1, win 501, length 2920
06:17:26.930757 IP 178.128.233.185.ssh > cpef81d0f81b843-cmf81d0f81b840.cpe.net.fido.ca.54364: Flags [P.], seq 10424:13344, ack 1, win 501, length 2920
06:17:26.930805 IP cpef81d0f81b843-cmf81d0f81b840.cpe.net.fido.ca.54364 > 178.128.233.185.ssh: Flags [.], ack 6952, win 512, length 0
06:17:26.930806 IP cpef81d0f81b843-cmf81d0f81b840.cpe.net.fido.ca.54364 > 178.128.233.185.ssh: Flags [.], ack 7136, win 511, length 0
06:17:26.930854 IP 178.128.233.185.ssh > cpef81d0f81b843-cmf81d0f81b840.cpe.net.fido.ca.54364: Flags [P.], seq 13344:13696, ack 1, win 501, length 352
06:17:26.931014 IP 178.128.233.185.ssh > cpef81d0f81b843-cmf81d0f81b840.cpe.net.fido.ca.54364: Flags [P.], seq 13696:13868, ack 1, win 501, length 172
06:17:26.931124 IP 178.128.233.185.ssh > cpef81d0f81b843-cmf81d0f81b840.cpe.net.fido.ca.54364: Flags [P.], seq 13868:13904, ack 1, win 501, length 36
06:17:26.931310 IP 178.128.233.185.ssh > cpef81d0f81b843-cmf81d0f81b840.cpe.net.fido.ca.54364: Flags [P.], seq 13904:14476, ack 1, win 501, length 572
06:17:26.931615 IP 178.128.233.185.ssh > cpef81d0f81b843-cmf81d0f81b840.cpe.net.fido.ca.54364: Flags [P.], seq 14476:15648, ack 1, win 501, length 1172
06:17:26.931826 IP 178.128.233.185.ssh > cpef81d0f81b843-cmf81d0f81b840.cpe.net.fido.ca.54364: Flags [P.], seq 15648:16292, ack 1, win 501, length 644
06:17:26.932004 IP 178.128.233.185.ssh > cpef81d0f81b843-cmf81d0f81b840.cpe.net.fido.ca.54364: Flags [P.], seq 16292:16480, ack 1, win 501, length 188
06:17:26.932153 IP 178.128.233.185.ssh > cpef81d0f81b843-cmf81d0f81b840.cpe.net.fido.ca.54364: Flags [P.], seq 16480:16668, ack 1, win 501, length 188
06:17:26.932302 IP 178.128.233.185.ssh > cpef81d0f81b843-cmf81d0f81b840.cpe.net.fido.ca.54364: Flags [P.], seq 16668:16856, ack 1, win 501, length 188
06:17:26.932444 IP 178.128.233.185.ssh > cpef81d0f81b843-cmf81d0f81b840.cpe.net.fido.ca.54364: Flags [P.], seq 16856:17044, ack 1, win 501, length 188
06:17:26.932615 IP 178.128.233.185.ssh > cpef81d0f81b843-cmf81d0f81b840.cpe.net.fido.ca.54364: Flags [P.], seq 17044:17232, ack 1, win 501, length 188
06:17:26.932766 IP 178.128.233.185.ssh > cpef81d0f81b843-cmf81d0f81b840.cpe.net.fido.ca.54364: Flags [P.], seq 17232:17420, ack 1, win 501, length 188
06:17:26.932911 IP 178.128.233.185.ssh > cpef81d0f81b843-cmf81d0f81b840.cpe.net.fido.ca.54364: Flags [P.], seq 17420:17608, ack 1, win 501, length 188
06:17:26.933052 IP 178.128.233.185.ssh > cpef81d0f81b843-cmf81d0f81b840.cpe.net.fido.ca.54364: Flags [P.], seq 17608:17796, ack 1, win 501, length 188
06:17:26.933272 IP 178.128.233.185.ssh > cpef81d0f81b843-cmf81d0f81b840.cpe.net.fido.ca.54364: Flags [P.], seq 17796:17984, ack 1, win 501, length 188
06:17:26.933483 IP 178.128.233.185.ssh > cpef81d0f81b843-cmf81d0f81b840.cpe.net.fido.ca.54364: Flags [P.], seq 17984:18172, ack 1, win 501, length 188
06:17:26.933693 IP 178.128.233.185.ssh > cpef81d0f81b843-cmf81d0f81b840.cpe.net.fido.ca.54364: Flags [P.], seq 18172:18360, ack 1, win 501, length 188
06:17:26.933938 IP 178.128.233.185.ssh > cpef81d0f81b843-cmf81d0f81b840.cpe.net.fido.ca.54364: Flags [P.], seq 18360:18548, ack 1, win 501, length 188
06:17:26.934121 IP 178.128.233.185.ssh > cpef81d0f81b843-cmf81d0f81b840.cpe.net.fido.ca.54364: Flags [P.], seq 18548:18736, ack 1, win 501, length 188
06:17:26.934298 IP 178.128.233.185.ssh > cpef81d0f81b843-cmf81d0f81b840.cpe.net.fido.ca.54364: Flags [P.], seq 18736:18924, ack 1, win 501, length 188
06:17:26.934479 IP 178.128.233.185.ssh > cpef81d0f81b843-cmf81d0f81b840.cpe.net.fido.ca.54364: Flags [P.], seq 18924:19112, ack 1, win 501, length 188
06:17:26.934656 IP 178.128.233.185.ssh > cpef81d0f81b843-cmf81d0f81b840.cpe.net.fido.ca.54364: Flags [P.], seq 19112:19300, ack 1, win 501, length 188
06:17:26.934833 IP 178.128.233.185.ssh > cpef81d0f81b843-cmf81d0f81b840.cpe.net.fido.ca.54364: Flags [P.], seq 19300:19488, ack 1, win 501, length 188
06:17:26.935014 IP 178.128.233.185.ssh > cpef81d0f81b843-cmf81d0f81b840.cpe.net.fido.ca.54364: Flags [P.], seq 19488:19676, ack 1, win 501, length 188
06:17:26.935197 IP 178.128.233.185.ssh > cpef81d0f81b843-cmf81d0f81b840.cpe.net.fido.ca.54364: Flags [P.], seq 19676:19864, ack 1, win 501, length 188
06:17:26.935459 IP cpef81d0f81b843-cmf81d0f81b840.cpe.net.fido.ca.54364 > 178.128.233.185.ssh: Flags [.], ack 7296, win 511, length 0
06:17:26.935460 IP cpef81d0f81b843-cmf81d0f81b840.cpe.net.fido.ca.54364 > 178.128.233.185.ssh: Flags [.], ack 7504, win 510, length 0
06:17:26.935499 IP 178.128.233.185.ssh > cpef81d0f81b843-cmf81d0f81b840.cpe.net.fido.ca.54364: Flags [P.], seq 19864:20052, ack 1, win 501, length 188
06:17:26.935773 IP 178.128.233.185.ssh > cpef81d0f81b843-cmf81d0f81b840.cpe.net.fido.ca.54364: Flags [P.], seq 20052:20512, ack 1, win 501, length 460
06:17:26.935949 IP 178.128.233.185.ssh > cpef81d0f81b843-cmf81d0f81b840.cpe.net.fido.ca.54364: Flags [P.], seq 20512:20700, ack 1, win 501, length 188
06:17:26.936128 IP 178.128.233.185.ssh > cpef81d0f81b843-cmf81d0f81b840.cpe.net.fido.ca.54364: Flags [P.], seq 20700:20888, ack 1, win 501, length 188
06:17:26.936301 IP 178.128.233.185.ssh > cpef81d0f81b843-cmf81d0f81b840.cpe.net.fido.ca.54364: Flags [P.], seq 20888:21076, ack 1, win 501, length 188
06:17:26.936474 IP 178.128.233.185.ssh > cpef81d0f81b843-cmf81d0f81b840.cpe.net.fido.ca.54364: Flags [P.], seq 21076:21264, ack 1, win 501, length 188
06:17:26.936643 IP 178.128.233.185.ssh > cpef81d0f81b843-cmf81d0f81b840.cpe.net.fido.ca.54364: Flags [P.], seq 21264:21452, ack 1, win 501, length 188
06:17:26.936805 IP 178.128.233.185.ssh > cpef81d0f81b843-cmf81d0f81b840.cpe.net.fido.ca.54364: Flags [P.], seq 21452:21640, ack 1, win 501, length 188
06:17:26.936977 IP 178.128.233.185.ssh > cpef81d0f81b843-cmf81d0f81b840.cpe.net.fido.ca.54364: Flags [P.], seq 21640:21828, ack 1, win 501, length 188
06:17:26.937139 IP 178.128.233.185.ssh > cpef81d0f81b843-cmf81d0f81b840.cpe.net.fido.ca.54364: Flags [P.], seq 21828:22016, ack 1, win 501, length 188
06:17:26.937264 IP 178.128.233.185.ssh > cpef81d0f81b843-cmf81d0f81b840.cpe.net.fido.ca.54364: Flags [P.], seq 22016:22204, ack 1, win 501, length 188
06:17:26.937380 IP 178.128.233.185.ssh > cpef81d0f81b843-cmf81d0f81b840.cpe.net.fido.ca.54364: Flags [P.], seq 22204:22392, ack 1, win 501, length 188
06:17:26.937497 IP 178.128.233.185.ssh > cpef81d0f81b843-cmf81d0f81b840.cpe.net.fido.ca.54364: Flags [P.], seq 22392:22580, ack 1, win 501, length 188
06:17:26.937614 IP 178.128.233.185.ssh > cpef81d0f81b843-cmf81d0f81b840.cpe.net.fido.ca.54364: Flags [P.], seq 22580:22768, ack 1, win 501, length 188
06:17:26.937729 IP 178.128.233.185.ssh > cpef81d0f81b843-cmf81d0f81b840.cpe.net.fido.ca.54364: Flags [P.], seq 22768:22956, ack 1, win 501, length 188
06:17:26.937862 IP 178.128.233.185.ssh > cpef81d0f81b843-cmf81d0f81b840.cpe.net.fido.ca.54364: Flags [P.], seq 22956:23144, ack 1, win 501, length 188
06:17:26.937979 IP 178.128.233.185.ssh > cpef81d0f81b843-cmf81d0f81b840.cpe.net.fido.ca.54364: Flags [P.], seq 23144:23332, ack 1, win 501, length 188
06:17:26.938093 IP 178.128.233.185.ssh > cpef81d0f81b843-cmf81d0f81b840.cpe.net.fido.ca.54364: Flags [P.], seq 23332:23520, ack 1, win 501, length 188
06:17:26.938220 IP 178.128.233.185.ssh > cpef81d0f81b843-cmf81d0f81b840.cpe.net.fido.ca.54364: Flags [P.], seq 23520:23708, ack 1, win 501, length 188
06:17:26.944528 IP cpef81d0f81b843-cmf81d0f81b840.cpe.net.fido.ca.54364 > 178.128.233.185.ssh: Flags [.], ack 13344, win 513, length 0
06:17:26.944529 IP cpef81d0f81b843-cmf81d0f81b840.cpe.net.fido.ca.54364 > 178.128.233.185.ssh: Flags [.], ack 13868, win 511, length 0
06:17:26.944529 IP cpef81d0f81b843-cmf81d0f81b840.cpe.net.fido.ca.54364 > 178.128.233.185.ssh: Flags [.], ack 14476, win 508, length 0
06:17:26.944529 IP cpef81d0f81b843-cmf81d0f81b840.cpe.net.fido.ca.54364 > 178.128.233.185.ssh: Flags [.], ack 16292, win 513, length 0
06:17:26.944529 IP cpef81d0f81b843-cmf81d0f81b840.cpe.net.fido.ca.54364 > 178.128.233.185.ssh: Flags [.], ack 17232, win 509, length 0
06:17:26.944529 IP cpef81d0f81b843-cmf81d0f81b840.cpe.net.fido.ca.54364 > 178.128.233.185.ssh: Flags [.], ack 17796, win 513, length 0
06:17:26.944577 IP 178.128.233.185.ssh > cpef81d0f81b843-cmf81d0f81b840.cpe.net.fido.ca.54364: Flags [P.], seq 23708:23896, ack 1, win 501, length 188
06:17:26.944815 IP 178.128.233.185.ssh > cpef81d0f81b843-cmf81d0f81b840.cpe.net.fido.ca.54364: Flags [P.], seq 23896:24900, ack 1, win 501, length 1004
06:17:26.944922 IP 178.128.233.185.ssh > cpef81d0f81b843-cmf81d0f81b840.cpe.net.fido.ca.54364: Flags [P.], seq 24900:25088, ack 1, win 501, length 188
06:17:26.945013 IP 178.128.233.185.ssh > cpef81d0f81b843-cmf81d0f81b840.cpe.net.fido.ca.54364: Flags [P.], seq 25088:25276, ack 1, win 501, length 188
06:17:26.945112 IP 178.128.233.185.ssh > cpef81d0f81b843-cmf81d0f81b840.cpe.net.fido.ca.54364: Flags [P.], seq 25276:25464, ack 1, win 501, length 188
06:17:26.945198 IP 178.128.233.185.ssh > cpef81d0f81b843-cmf81d0f81b840.cpe.net.fido.ca.54364: Flags [P.], seq 25464:25652, ack 1, win 501, length 188
06:17:26.945282 IP 178.128.233.185.ssh > cpef81d0f81b843-cmf81d0f81b840.cpe.net.fido.ca.54364: Flags [P.], seq 25652:25840, ack 1, win 501, length 188
06:17:26.945366 IP 178.128.233.185.ssh > cpef81d0f81b843-cmf81d0f81b840.cpe.net.fido.ca.54364: Flags [P.], seq 25840:26028, ack 1, win 501, length 188
06:17:26.945452 IP 178.128.233.185.ssh > cpef81d0f81b843-cmf81d0f81b840.cpe.net.fido.ca.54364: Flags [P.], seq 26028:26216, ack 1, win 501, length 188
06:17:26.945537 IP 178.128.233.185.ssh > cpef81d0f81b843-cmf81d0f81b840.cpe.net.fido.ca.54364: Flags [P.], seq 26216:26404, ack 1, win 501, length 188
06:17:26.945619 IP 178.128.233.185.ssh > cpef81d0f81b843-cmf81d0f81b840.cpe.net.fido.ca.54364: Flags [P.], seq 26404:26592, ack 1, win 501, length 188
06:17:26.945696 IP 178.128.233.185.ssh > cpef81d0f81b843-cmf81d0f81b840.cpe.net.fido.ca.54364: Flags [P.], seq 26592:26780, ack 1, win 501, length 188
06:17:26.945803 IP 178.128.233.185.ssh > cpef81d0f81b843-cmf81d0f81b840.cpe.net.fido.ca.54364: Flags [P.], seq 26780:26968, ack 1, win 501, length 188
06:17:26.945888 IP 178.128.233.185.ssh > cpef81d0f81b843-cmf81d0f81b840.cpe.net.fido.ca.54364: Flags [P.], seq 26968:27156, ack 1, win 501, length 188
06:17:26.945973 IP 178.128.233.185.ssh > cpef81d0f81b843-cmf81d0f81b840.cpe.net.fido.ca.54364: Flags [P.], seq 27156:27344, ack 1, win 501, length 188
06:17:26.946051 IP 178.128.233.185.ssh > cpef81d0f81b843-cmf81d0f81b840.cpe.net.fido.ca.54364: Flags [P.], seq 27344:27532, ack 1, win 501, length 188
06:17:26.946134 IP 178.128.233.185.ssh > cpef81d0f81b843-cmf81d0f81b840.cpe.net.fido.ca.54364: Flags [P.], seq 27532:27720, ack 1, win 501, length 188
06:17:26.946223 IP 178.128.233.185.ssh > cpef81d0f81b843-cmf81d0f81b840.cpe.net.fido.ca.54364: Flags [P.], seq 27720:27908, ack 1, win 501, length 188
06:17:26.946308 IP 178.128.233.185.ssh > cpef81d0f81b843-cmf81d0f81b840.cpe.net.fido.ca.54364: Flags [P.], seq 27908:28096, ack 1, win 501, length 188
06:17:26.946389 IP 178.128.233.185.ssh > cpef81d0f81b843-cmf81d0f81b840.cpe.net.fido.ca.54364: Flags [P.], seq 28096:28284, ack 1, win 501, length 188
06:17:26.946468 IP 178.128.233.185.ssh > cpef81d0f81b843-cmf81d0f81b840.cpe.net.fido.ca.54364: Flags [P.], seq 28284:28472, ack 1, win 501, length 188
06:17:26.946553 IP 178.128.233.185.ssh > cpef81d0f81b843-cmf81d0f81b840.cpe.net.fido.ca.54364: Flags [P.], seq 28472:28660, ack 1, win 501, length 188
06:17:26.947099 IP 178.128.233.185.ssh > cpef81d0f81b843-cmf81d0f81b840.cpe.net.fido.ca.54364: Flags [P.], seq 28660:28848, ack 1, win 501, length 188
06:17:26.947204 IP 178.128.233.185.ssh > cpef81d0f81b843-cmf81d0f81b840.cpe.net.fido.ca.54364: Flags [P.], seq 28848:29036, ack 1, win 501, length 188
06:17:26.947386 IP 178.128.233.185.ssh > cpef81d0f81b843-cmf81d0f81b840.cpe.net.fido.ca.54364: Flags [P.], seq 29036:29224, ack 1, win 501, length 188
06:17:26.947507 IP 178.128.233.185.ssh > cpef81d0f81b843-cmf81d0f81b840.cpe.net.fido.ca.54364: Flags [P.], seq 29224:29412, ack 1, win 501, length 188
06:17:26.947624 IP 178.128.233.185.ssh > cpef81d0f81b843-cmf81d0f81b840.cpe.net.fido.ca.54364: Flags [P.], seq 29412:29600, ack 1, win 501, length 188
06:17:26.947739 IP 178.128.233.185.ssh > cpef81d0f81b843-cmf81d0f81b840.cpe.net.fido.ca.54364: Flags [P.], seq 29600:29788, ack 1, win 501, length 188
06:17:26.947852 IP 178.128.233.185.ssh > cpef81d0f81b843-cmf81d0f81b840.cpe.net.fido.ca.54364: Flags [P.], seq 29788:29976, ack 1, win 501, length 188
06:17:26.947965 IP 178.128.233.185.ssh > cpef81d0f81b843-cmf81d0f81b840.cpe.net.fido.ca.54364: Flags [P.], seq 29976:30164, ack 1, win 501, length 188
06:17:26.948077 IP 178.128.233.185.ssh > cpef81d0f81b843-cmf81d0f81b840.cpe.net.fido.ca.54364: Flags [P.], seq 30164:30352, ack 1, win 501, length 188
06:17:26.948202 IP 178.128.233.185.ssh > cpef81d0f81b843-cmf81d0f81b840.cpe.net.fido.ca.54364: Flags [P.], seq 30352:30540, ack 1, win 501, length 188